Question_Type,Answer_Type,Topic_Number,Variation,Question,Correct_Answer_1,Correct_Answer_2,Correct_Answer_3,Correct_Answer_4,Wrong_Answer_1,Wrong_Answer_2,Wrong_Answer_3,Time_in_seconds,Difficulty_Level,Question_IAV,ContributorMail,Solution_text,Solution_IAV
text,v3_15,30203,7,"Vivek has some pencils. Vivek sells 30 of them in the market and left with 71 pencils How many pencils Vivek had initially ?.
",Vivek had 101 pencils,,,,Vivek had 102 pencils,Vivek had 40 pencils,Vivek had 41 pencils,60,3,,,"Let us assume that the number of pencils with Vivek at first be $x$<br/>Vivek sold $30$pencils and left with $71$pencils<br/> Number of pencils left =  Number of pencils initially -  Number of pencils sold at the market <br/> Therefore,$x -30 = 71$ <br/>$x - 30 + 30 = 71 + 30$   (Add $30$ to both sides)<br/>$ x + 0 =101$<br/>$ x = 101$<br/> Thus, there were $101$ pencils with Vivek at first",
text,v3_15,30203,7,"Anmol has some books. Anmol sells 9 of them in the market and left with 69 books How many books Anmol had initially ?.
",Anmol had 78 books,,,,Anmol had 79 books,Anmol had 59 books,Anmol had 60 books,60,3,,,"Let us assume that the number of books with Anmol at first be $x$<br/>Anmol sold $9$books and left with $69$books<br/> Number of books left =  Number of books initially -  Number of books sold at the market <br/> Therefore,$x -9 = 69$ <br/>$x - 9 + 9 = 69 + 9$   (Add $9$ to both sides)<br/>$ x + 0 =78$<br/>$ x = 78$<br/> Thus, there were $78$ books with Anmol at first",
text,v3_15,30203,7,"Prajwal has some Sheeps. Prajwal sells 1 of them in the market and left with 96 Sheeps How many Sheeps Prajwal had initially ?.
",Prajwal had 97 Sheeps,,,,Prajwal had 98 Sheeps,Prajwal had 94 Sheeps,Prajwal had 95 Sheeps,60,3,,,"Let us assume that the number of Sheeps with Prajwal at first be $x$<br/>Prajwal sold $1$Sheeps and left with $96$Sheeps<br/> Number of Sheeps left =  Number of Sheeps initially -  Number of Sheeps sold at the market <br/> Therefore,$x -1 = 96$ <br/>$x - 1 + 1 = 96 + 1$   (Add $1$ to both sides)<br/>$ x + 0 =97$<br/>$ x = 97$<br/> Thus, there were $97$ Sheeps with Prajwal at first",
text,v3_15,30203,7,"Gopal has some books. Gopal sells 34 of them in the market and left with 58 books How many books Gopal had initially ?.
",Gopal had 92 books,,,,Gopal had 93 books,Gopal had 23 books,Gopal had 24 books,60,3,,,"Let us assume that the number of books with Gopal at first be $x$<br/>Gopal sold $34$books and left with $58$books<br/> Number of books left =  Number of books initially -  Number of books sold at the market <br/> Therefore,$x -34 = 58$ <br/>$x - 34 + 34 = 58 + 34$   (Add $34$ to both sides)<br/>$ x + 0 =92$<br/>$ x = 92$<br/> Thus, there were $92$ books with Gopal at first",
text,v3_15,30203,7,"Gagan has some sheets. Gagan sells 18 of them in the market and left with 77 sheets How many sheets Gagan had initially ?.
",Gagan had 95 sheets,,,,Gagan had 96 sheets,Gagan had 58 sheets,Gagan had 59 sheets,60,3,,,"Let us assume that the number of sheets with Gagan at first be $x$<br/>Gagan sold $18$sheets and left with $77$sheets<br/> Number of sheets left =  Number of sheets initially -  Number of sheets sold at the market <br/> Therefore,$x -18 = 77$ <br/>$x - 18 + 18 = 77 + 18$   (Add $18$ to both sides)<br/>$ x + 0 =95$<br/>$ x = 95$<br/> Thus, there were $95$ sheets with Gagan at first",
text,v3_15,30203,7,"Vaibhav has some Jackets. Vaibhav sells 18 of them in the market and left with 95 Jackets How many Jackets Vaibhav had initially ?.
",Vaibhav had 113 Jackets,,,,Vaibhav had 114 Jackets,Vaibhav had 76 Jackets,Vaibhav had 77 Jackets,60,3,,,"Let us assume that the number of Jackets with Vaibhav at first be $x$<br/>Vaibhav sold $18$Jackets and left with $95$Jackets<br/> Number of Jackets left =  Number of Jackets initially -  Number of Jackets sold at the market <br/> Therefore,$x -18 = 95$ <br/>$x - 18 + 18 = 95 + 18$   (Add $18$ to both sides)<br/>$ x + 0 =113$<br/>$ x = 113$<br/> Thus, there were $113$ Jackets with Vaibhav at first",
text,v3_15,30203,7,"Rahul has some shirts. Rahul sells 31 of them in the market and left with 84 shirts How many shirts Rahul had initially ?.
",Rahul had 115 shirts,,,,Rahul had 116 shirts,Rahul had 52 shirts,Rahul had 53 shirts,60,3,,,"Let us assume that the number of shirts with Rahul at first be $x$<br/>Rahul sold $31$shirts and left with $84$shirts<br/> Number of shirts left =  Number of shirts initially -  Number of shirts sold at the market <br/> Therefore,$x -31 = 84$ <br/>$x - 31 + 31 = 84 + 31$   (Add $31$ to both sides)<br/>$ x + 0 =115$<br/>$ x = 115$<br/> Thus, there were $115$ shirts with Rahul at first",
text,v3_15,30203,7,"Siddhesh has some pens. Siddhesh sells 5 of them in the market and left with 44 pens How many pens Siddhesh had initially ?.
",Siddhesh had 49 pens,,,,Siddhesh had 50 pens,Siddhesh had 38 pens,Siddhesh had 39 pens,60,3,,,"Let us assume that the number of pens with Siddhesh at first be $x$<br/>Siddhesh sold $5$pens and left with $44$pens<br/> Number of pens left =  Number of pens initially -  Number of pens sold at the market <br/> Therefore,$x -5 = 44$ <br/>$x - 5 + 5 = 44 + 5$   (Add $5$ to both sides)<br/>$ x + 0 =49$<br/>$ x = 49$<br/> Thus, there were $49$ pens with Siddhesh at first",
text,v3_15,30203,7,"Ganesh has some Watermelons. Ganesh sells 7 of them in the market and left with 59 Watermelons How many Watermelons Ganesh had initially ?.
",Ganesh had 66 Watermelons,,,,Ganesh had 67 Watermelons,Ganesh had 51 Watermelons,Ganesh had 52 Watermelons,60,3,,,"Let us assume that the number of Watermelons with Ganesh at first be $x$<br/>Ganesh sold $7$Watermelons and left with $59$Watermelons<br/> Number of Watermelons left =  Number of Watermelons initially -  Number of Watermelons sold at the market <br/> Therefore,$x -7 = 59$ <br/>$x - 7 + 7 = 59 + 7$   (Add $7$ to both sides)<br/>$ x + 0 =66$<br/>$ x = 66$<br/> Thus, there were $66$ Watermelons with Ganesh at first",
text,v3_15,30203,7,"Om has some T-shirts. Om sells 17 of them in the market and left with 63 T-shirts How many T-shirts Om had initially ?.
",Om had 80 T-shirts,,,,Om had 81 T-shirts,Om had 45 T-shirts,Om had 46 T-shirts,60,3,,,"Let us assume that the number of T-shirts with Om at first be $x$<br/>Om sold $17$T-shirts and left with $63$T-shirts<br/> Number of T-shirts left =  Number of T-shirts initially -  Number of T-shirts sold at the market <br/> Therefore,$x -17 = 63$ <br/>$x - 17 + 17 = 63 + 17$   (Add $17$ to both sides)<br/>$ x + 0 =80$<br/>$ x = 80$<br/> Thus, there were $80$ T-shirts with Om at first",
text,v3_15,30203,7,"Manish has some chocolates. Manish sells 11 of them in the market and left with 81 chocolates How many chocolates Manish had initially ?.
",Manish had 92 chocolates,,,,Manish had 93 chocolates,Manish had 69 chocolates,Manish had 70 chocolates,60,3,,,"Let us assume that the number of chocolates with Manish at first be $x$<br/>Manish sold $11$chocolates and left with $81$chocolates<br/> Number of chocolates left =  Number of chocolates initially -  Number of chocolates sold at the market <br/> Therefore,$x -11 = 81$ <br/>$x - 11 + 11 = 81 + 11$   (Add $11$ to both sides)<br/>$ x + 0 =92$<br/>$ x = 92$<br/> Thus, there were $92$ chocolates with Manish at first",
text,v3_15,30203,7,"Pooja has some candies. Pooja sells 29 of them in the market and left with 95 candies How many candies Pooja had initially ?.
",Pooja had 124 candies,,,,Pooja had 125 candies,Pooja had 65 candies,Pooja had 66 candies,60,3,,,"Let us assume that the number of candies with Pooja at first be $x$<br/>Pooja sold $29$candies and left with $95$candies<br/> Number of candies left =  Number of candies initially -  Number of candies sold at the market <br/> Therefore,$x -29 = 95$ <br/>$x - 29 + 29 = 95 + 29$   (Add $29$ to both sides)<br/>$ x + 0 =124$<br/>$ x = 124$<br/> Thus, there were $124$ candies with Pooja at first",
text,v3_15,30203,7,"Gargi has some Sheeps. Gargi sells 10 of them in the market and left with 91 Sheeps How many Sheeps Gargi had initially ?.
",Gargi had 101 Sheeps,,,,Gargi had 102 Sheeps,Gargi had 80 Sheeps,Gargi had 81 Sheeps,60,3,,,"Let us assume that the number of Sheeps with Gargi at first be $x$<br/>Gargi sold $10$Sheeps and left with $91$Sheeps<br/> Number of Sheeps left =  Number of Sheeps initially -  Number of Sheeps sold at the market <br/> Therefore,$x -10 = 91$ <br/>$x - 10 + 10 = 91 + 10$   (Add $10$ to both sides)<br/>$ x + 0 =101$<br/>$ x = 101$<br/> Thus, there were $101$ Sheeps with Gargi at first",
text,v3_15,30203,7,"Aditi has some shirts. Aditi sells 14 of them in the market and left with 71 shirts How many shirts Aditi had initially ?.
",Aditi had 85 shirts,,,,Aditi had 86 shirts,Aditi had 56 shirts,Aditi had 57 shirts,60,3,,,"Let us assume that the number of shirts with Aditi at first be $x$<br/>Aditi sold $14$shirts and left with $71$shirts<br/> Number of shirts left =  Number of shirts initially -  Number of shirts sold at the market <br/> Therefore,$x -14 = 71$ <br/>$x - 14 + 14 = 71 + 14$   (Add $14$ to both sides)<br/>$ x + 0 =85$<br/>$ x = 85$<br/> Thus, there were $85$ shirts with Aditi at first",
text,v3_15,30203,7,"Pranali has some sheets. Pranali sells 13 of them in the market and left with 46 sheets How many sheets Pranali had initially ?.
",Pranali had 59 sheets,,,,Pranali had 60 sheets,Pranali had 32 sheets,Pranali had 33 sheets,60,3,,,"Let us assume that the number of sheets with Pranali at first be $x$<br/>Pranali sold $13$sheets and left with $46$sheets<br/> Number of sheets left =  Number of sheets initially -  Number of sheets sold at the market <br/> Therefore,$x -13 = 46$ <br/>$x - 13 + 13 = 46 + 13$   (Add $13$ to both sides)<br/>$ x + 0 =59$<br/>$ x = 59$<br/> Thus, there were $59$ sheets with Pranali at first",
text,v3_15,30203,7,"Gagan has some T-shirts. Gagan sells 18 of them in the market and left with 86 T-shirts How many T-shirts Gagan had initially ?.
",Gagan had 104 T-shirts,,,,Gagan had 105 T-shirts,Gagan had 67 T-shirts,Gagan had 68 T-shirts,60,3,,,"Let us assume that the number of T-shirts with Gagan at first be $x$<br/>Gagan sold $18$T-shirts and left with $86$T-shirts<br/> Number of T-shirts left =  Number of T-shirts initially -  Number of T-shirts sold at the market <br/> Therefore,$x -18 = 86$ <br/>$x - 18 + 18 = 86 + 18$   (Add $18$ to both sides)<br/>$ x + 0 =104$<br/>$ x = 104$<br/> Thus, there were $104$ T-shirts with Gagan at first",
text,v3_15,30203,7,"Isha has some Sheeps. Isha sells 2 of them in the market and left with 80 Sheeps How many Sheeps Isha had initially ?.
",Isha had 82 Sheeps,,,,Isha had 83 Sheeps,Isha had 77 Sheeps,Isha had 78 Sheeps,60,3,,,"Let us assume that the number of Sheeps with Isha at first be $x$<br/>Isha sold $2$Sheeps and left with $80$Sheeps<br/> Number of Sheeps left =  Number of Sheeps initially -  Number of Sheeps sold at the market <br/> Therefore,$x -2 = 80$ <br/>$x - 2 + 2 = 80 + 2$   (Add $2$ to both sides)<br/>$ x + 0 =82$<br/>$ x = 82$<br/> Thus, there were $82$ Sheeps with Isha at first",
text,v3_15,30203,7,"Akshata has some T-shirts. Akshata sells 30 of them in the market and left with 54 T-shirts How many T-shirts Akshata had initially ?.
",Akshata had 84 T-shirts,,,,Akshata had 85 T-shirts,Akshata had 23 T-shirts,Akshata had 24 T-shirts,60,3,,,"Let us assume that the number of T-shirts with Akshata at first be $x$<br/>Akshata sold $30$T-shirts and left with $54$T-shirts<br/> Number of T-shirts left =  Number of T-shirts initially -  Number of T-shirts sold at the market <br/> Therefore,$x -30 = 54$ <br/>$x - 30 + 30 = 54 + 30$   (Add $30$ to both sides)<br/>$ x + 0 =84$<br/>$ x = 84$<br/> Thus, there were $84$ T-shirts with Akshata at first",
text,v3_15,30203,7,"Akshata has some Cookies. Akshata sells 23 of them in the market and left with 78 Cookies How many Cookies Akshata had initially ?.
",Akshata had 101 Cookies,,,,Akshata had 102 Cookies,Akshata had 54 Cookies,Akshata had 55 Cookies,60,3,,,"Let us assume that the number of Cookies with Akshata at first be $x$<br/>Akshata sold $23$Cookies and left with $78$Cookies<br/> Number of Cookies left =  Number of Cookies initially -  Number of Cookies sold at the market <br/> Therefore,$x -23 = 78$ <br/>$x - 23 + 23 = 78 + 23$   (Add $23$ to both sides)<br/>$ x + 0 =101$<br/>$ x = 101$<br/> Thus, there were $101$ Cookies with Akshata at first",
text,v3_15,30203,7,"Ishika has some Bananas. Ishika sells 4 of them in the market and left with 83 Bananas How many Bananas Ishika had initially ?.
",Ishika had 87 Bananas,,,,Ishika had 88 Bananas,Ishika had 78 Bananas,Ishika had 79 Bananas,60,3,,,"Let us assume that the number of Bananas with Ishika at first be $x$<br/>Ishika sold $4$Bananas and left with $83$Bananas<br/> Number of Bananas left =  Number of Bananas initially -  Number of Bananas sold at the market <br/> Therefore,$x -4 = 83$ <br/>$x - 4 + 4 = 83 + 4$   (Add $4$ to both sides)<br/>$ x + 0 =87$<br/>$ x = 87$<br/> Thus, there were $87$ Bananas with Ishika at first",
text,v3_15,30203,7,"Mihir has some pencils. Mihir sells 20 of them in the market and left with 66 pencils How many pencils Mihir had initially ?.
",Mihir had 86 pencils,,,,Mihir had 87 pencils,Mihir had 45 pencils,Mihir had 46 pencils,60,3,,,"Let us assume that the number of pencils with Mihir at first be $x$<br/>Mihir sold $20$pencils and left with $66$pencils<br/> Number of pencils left =  Number of pencils initially -  Number of pencils sold at the market <br/> Therefore,$x -20 = 66$ <br/>$x - 20 + 20 = 66 + 20$   (Add $20$ to both sides)<br/>$ x + 0 =86$<br/>$ x = 86$<br/> Thus, there were $86$ pencils with Mihir at first",
